{
  "checks": [
    {
      "check_id": "CHK-01",
      "note": "テスト用記録で適用項目を確認しました。",
      "result": "pass"
    },
    {
      "check_id": "CHK-02",
      "note": "テスト用記録で適用項目を確認しました。",
      "result": "pass"
    },
    {
      "check_id": "CHK-03",
      "note": "テスト用記録で適用項目を確認しました。",
      "result": "pass"
    },
    {
      "check_id": "CHK-04",
      "note": "テスト用記録で適用項目を確認しました。",
      "result": "pass"
    },
    {
      "check_id": "CHK-05",
      "note": "テスト用記録で適用項目を確認しました。",
      "result": "pass"
    },
    {
      "check_id": "CHK-06",
      "note": "テスト用記録で適用項目を確認しました。",
      "result": "pass"
    },
    {
      "check_id": "CHK-07",
      "note": "テスト用記録で適用項目を確認しました。",
      "result": "pass"
    },
    {
      "check_id": "CHK-08",
      "note": "テスト用記録で適用項目を確認しました。",
      "result": "pass"
    },
    {
      "check_id": "CHK-09",
      "note": "テスト用記録で適用項目を確認しました。",
      "result": "pass"
    },
    {
      "check_id": "CHK-10",
      "note": "テスト用記録で適用項目を確認しました。",
      "result": "pass"
    },
    {
      "check_id": "CHK-11",
      "note": "テスト用記録で適用項目を確認しました。",
      "result": "pass"
    },
    {
      "check_id": "CHK-12",
      "note": "テスト用記録で適用項目を確認しました。",
      "result": "pass"
    },
    {
      "check_id": "CHK-13",
      "note": "テスト用記録で適用項目を確認しました。",
      "result": "pass"
    },
    {
      "check_id": "CHK-14",
      "note": "テスト用記録で適用項目を確認しました。",
      "result": "pass"
    },
    {
      "check_id": "CHK-15",
      "note": "テスト用記録で適用項目を確認しました。",
      "result": "pass"
    },
    {
      "check_id": "CHK-16",
      "note": "テスト用記録で適用項目を確認しました。",
      "result": "pass"
    },
    {
      "check_id": "CHK-17",
      "note": "テスト用記録で適用項目を確認しました。",
      "result": "pass"
    },
    {
      "check_id": "CHK-18",
      "note": "テスト用記録で適用項目を確認しました。",
      "result": "pass"
    },
    {
      "check_id": "CHK-19",
      "note": "テスト用記録で適用項目を確認しました。",
      "result": "pass"
    }
  ],
  "generation": "gen1",
  "machine_check_disputes": [],
  "question_id": "q03",
  "schema_version": "1.0.0",
  "sentence_grammar_inventory": [],
  "set_id": "20990101-000000-rpl1",
  "verdict": "pass",
  "violations": []
}
