{
  "checks": [
    {
      "check_id": "CHK-01",
      "note": "形式③のため",
      "result": "not_applicable"
    },
    {
      "check_id": "CHK-02",
      "note": "テスト用記録で適用項目を確認しました。",
      "result": "pass"
    },
    {
      "check_id": "CHK-03",
      "note": "テスト用記録で適用項目を確認しました。",
      "result": "pass"
    },
    {
      "check_id": "CHK-04",
      "note": "テスト用記録で適用項目を確認しました。",
      "result": "pass"
    },
    {
      "check_id": "CHK-05",
      "note": "形式③のため",
      "result": "not_applicable"
    },
    {
      "check_id": "CHK-06",
      "note": "形式③のため",
      "result": "not_applicable"
    },
    {
      "check_id": "CHK-07",
      "note": "形式③のため",
      "result": "not_applicable"
    },
    {
      "check_id": "CHK-08",
      "note": "テスト用記録で適用項目を確認しました。",
      "result": "pass"
    },
    {
      "check_id": "CHK-09",
      "note": "形式③のため",
      "result": "not_applicable"
    },
    {
      "check_id": "CHK-10",
      "note": "形式③のため",
      "result": "not_applicable"
    },
    {
      "check_id": "CHK-11",
      "note": "テスト用記録で適用項目を確認しました。",
      "result": "pass"
    },
    {
      "check_id": "CHK-12",
      "note": "テスト用記録で適用項目を確認しました。",
      "result": "pass"
    },
    {
      "check_id": "CHK-13",
      "note": "テスト用記録で適用項目を確認しました。",
      "result": "pass"
    },
    {
      "check_id": "CHK-14",
      "note": "形式③のため",
      "result": "not_applicable"
    },
    {
      "check_id": "CHK-15",
      "note": "形式③のため",
      "result": "not_applicable"
    },
    {
      "check_id": "CHK-16",
      "note": "形式③のため",
      "result": "not_applicable"
    },
    {
      "check_id": "CHK-17",
      "note": "形式③のため",
      "result": "not_applicable"
    },
    {
      "check_id": "CHK-18",
      "note": "テスト用記録で適用項目を確認しました。",
      "result": "pass"
    },
    {
      "check_id": "CHK-19",
      "note": "トピック指定なしのため",
      "result": "not_applicable"
    }
  ],
  "generation": "gen1",
  "machine_check_disputes": [],
  "question_id": "q01",
  "schema_version": "1.0.0",
  "sentence_grammar_inventory": [
    {
      "evidence": "教員版 gp:6 のレベル A1.1-A1.2 を引用しました。",
      "grammar_item_id": "gp:6",
      "level": "A1.1-A1.2",
      "level_source": "kyoinban",
      "span": "your",
      "structure": "人称代名詞所有格(my/our/your/her/their)"
    },
    {
      "evidence": "教員版 gp:59 のレベル A1.1 を引用しました。",
      "grammar_item_id": "gp:59",
      "level": "A1.1",
      "level_source": "kyoinban",
      "span": "accept",
      "structure": "時制・相(現在)(一般動詞・3人称単数以外)"
    },
    {
      "evidence": "教員版 gp:196 のレベル A1.1-A2.2 を引用しました。",
      "grammar_item_id": "gp:196",
      "level": "A1.1-A2.2",
      "level_source": "kyoinban",
      "span": "I accept your ability.",
      "structure": "S+V+O"
    }
  ],
  "set_id": "20990101-000000-rpl1",
  "verdict": "pass",
  "violations": []
}
