{
  "checks": [
    {
      "check_id": "CHK-01",
      "note": "テスト用記録で適用項目を確認しました。",
      "result": "pass"
    },
    {
      "check_id": "CHK-02",
      "note": "形式⑥のため",
      "result": "not_applicable"
    },
    {
      "check_id": "CHK-03",
      "note": "テスト用記録で適用項目を確認しました。",
      "result": "pass"
    },
    {
      "check_id": "CHK-04",
      "note": "テスト用記録で適用項目を確認しました。",
      "result": "pass"
    },
    {
      "check_id": "CHK-05",
      "note": "テスト用記録で適用項目を確認しました。",
      "result": "pass"
    },
    {
      "check_id": "CHK-06",
      "note": "形式⑥のため",
      "result": "not_applicable"
    },
    {
      "check_id": "CHK-07",
      "note": "形式⑥のため",
      "result": "not_applicable"
    },
    {
      "check_id": "CHK-08",
      "note": "テスト用記録で適用項目を確認しました。",
      "result": "pass"
    },
    {
      "check_id": "CHK-09",
      "note": "形式⑥のため",
      "result": "not_applicable"
    },
    {
      "check_id": "CHK-10",
      "note": "テスト用記録で適用項目を確認しました。",
      "result": "pass"
    },
    {
      "check_id": "CHK-11",
      "note": "テスト用記録で適用項目を確認しました。",
      "result": "pass"
    },
    {
      "check_id": "CHK-12",
      "note": "テスト用記録で適用項目を確認しました。",
      "result": "pass"
    },
    {
      "check_id": "CHK-13",
      "note": "テスト用記録で適用項目を確認しました。",
      "result": "pass"
    },
    {
      "check_id": "CHK-14",
      "note": "形式⑥のため",
      "result": "not_applicable"
    },
    {
      "check_id": "CHK-15",
      "note": "テスト用記録で適用項目を確認しました。",
      "result": "pass"
    },
    {
      "check_id": "CHK-16",
      "note": "形式⑥のため",
      "result": "not_applicable"
    },
    {
      "check_id": "CHK-17",
      "note": "例文が1文のため",
      "result": "not_applicable"
    },
    {
      "check_id": "CHK-18",
      "note": "テスト用記録で適用項目を確認しました。",
      "result": "pass"
    },
    {
      "check_id": "CHK-19",
      "note": "トピック指定なしのため",
      "result": "not_applicable"
    }
  ],
  "generation": "gen1",
  "machine_check_disputes": [],
  "question_id": "q01",
  "schema_version": "1.0.0",
  "sentence_grammar_inventory": [
    {
      "evidence": "教員版 gp:1 のレベル A1.1-A1.2 を引用しました。",
      "grammar_item_id": "gp:1",
      "level": "A1.1-A1.2",
      "level_source": "kyoinban",
      "span": "I am",
      "structure": "人称代名詞主格(I)+be: I am"
    },
    {
      "evidence": "教員版 gp:33 のレベル A1.1-B1.2 を引用しました。",
      "grammar_item_id": "gp:33",
      "level": "A1.1-B1.2",
      "level_source": "kyoinban",
      "span": "very happy",
      "structure": "副詞(強意)"
    },
    {
      "evidence": "教員版 gp:58 のレベル A1.1 を引用しました。",
      "grammar_item_id": "gp:58",
      "level": "A1.1",
      "level_source": "kyoinban",
      "span": "am",
      "structure": "時制・相(現在)(be動詞)"
    }
  ],
  "set_id": "20990101-000000-rpl1",
  "verdict": "pass",
  "violations": []
}
