{
  "checks": [
    {
      "check_id": "CHK-01",
      "note": "形式③のため",
      "result": "not_applicable"
    },
    {
      "check_id": "CHK-02",
      "note": "テスト用記録で適用項目を確認しました。",
      "result": "pass"
    },
    {
      "check_id": "CHK-03",
      "note": "テスト用記録で適用項目を確認しました。",
      "result": "pass"
    },
    {
      "check_id": "CHK-04",
      "note": "テスト用記録で適用項目を確認しました。",
      "result": "pass"
    },
    {
      "check_id": "CHK-05",
      "note": "形式③のため",
      "result": "not_applicable"
    },
    {
      "check_id": "CHK-06",
      "note": "形式③のため",
      "result": "not_applicable"
    },
    {
      "check_id": "CHK-07",
      "note": "形式③のため",
      "result": "not_applicable"
    },
    {
      "check_id": "CHK-08",
      "note": "テスト用記録で適用項目を確認しました。",
      "result": "pass"
    },
    {
      "check_id": "CHK-09",
      "note": "形式③のため",
      "result": "not_applicable"
    },
    {
      "check_id": "CHK-10",
      "note": "形式③のため",
      "result": "not_applicable"
    },
    {
      "check_id": "CHK-11",
      "note": "テスト用記録で適用項目を確認しました。",
      "result": "pass"
    },
    {
      "check_id": "CHK-12",
      "note": "テスト用記録で適用項目を確認しました。",
      "result": "pass"
    },
    {
      "check_id": "CHK-13",
      "note": "テスト用記録で適用項目を確認しました。",
      "result": "pass"
    },
    {
      "check_id": "CHK-14",
      "note": "形式③のため",
      "result": "not_applicable"
    },
    {
      "check_id": "CHK-15",
      "note": "形式③のため",
      "result": "not_applicable"
    },
    {
      "check_id": "CHK-16",
      "note": "形式③のため",
      "result": "not_applicable"
    },
    {
      "check_id": "CHK-17",
      "note": "形式③のため",
      "result": "not_applicable"
    },
    {
      "check_id": "CHK-18",
      "note": "テスト用記録で適用項目を確認しました。",
      "result": "pass"
    },
    {
      "check_id": "CHK-19",
      "note": "トピック指定なしのため",
      "result": "not_applicable"
    }
  ],
  "generation": "gen3",
  "machine_check_disputes": [],
  "question_id": "q02",
  "schema_version": "1.0.0",
  "sentence_grammar_inventory": [
    {
      "evidence": "教員版 gp:7 のレベル A1.1-A1.2 を引用しました。",
      "grammar_item_id": "gp:7",
      "level": "A1.1-A1.2",
      "level_source": "kyoinban",
      "span": "us",
      "structure": "人称代名詞目的格(me/us/him/her/them)"
    },
    {
      "evidence": "教員版 gp:14 のレベル A1.1 を引用しました。",
      "grammar_item_id": "gp:14",
      "level": "A1.1",
      "level_source": "kyoinban",
      "span": "the",
      "structure": "定冠詞"
    },
    {
      "evidence": "教員版 gp:88 のレベル A1.1-A2.2 を引用しました。",
      "grammar_item_id": "gp:88",
      "level": "A1.1-A2.2",
      "level_source": "kyoinban",
      "span": "to help",
      "structure": "to不定詞"
    },
    {
      "evidence": "教員版 gp:196 のレベル A1.1-A2.2 を引用しました。",
      "grammar_item_id": "gp:196",
      "level": "A1.1-A2.2",
      "level_source": "kyoinban",
      "span": "She has the ability to help us.",
      "structure": "S+V+O"
    },
    {
      "evidence": "reviewer_estimate: 主動詞haveの3人称単数現在形hasは、基本的な所有・状態を表す現在時制として導入レベルをA1.1と推定しました。",
      "grammar_item_id": null,
      "level": "A1.1",
      "level_source": "reviewer_estimate",
      "span": "has",
      "structure": "時制・相(現在)(主動詞have・3人称単数)"
    }
  ],
  "set_id": "20990101-000000-rpl1",
  "verdict": "pass",
  "violations": []
}
